{
  "metadata": {
    "schema_version": 2,
    "dataset_id": "key_rate",
    "status": "ok",
    "status_reason": null,
    "source_name": "Банк России",
    "source_url": "https://www.cbr.ru/hd_base/keyrate/",
    "source_export_url": "https://www.cbr.ru/DailyInfoWebServ/DailyInfo.asmx",
    "source_checksum_sha256": "839ef23cdb1a30240d815fc7be91ee92af11a4c8e4d6b5e6894c45175bfd33f4",
    "payload_checksum_sha256": "d8eecbbc377657bc6e0dfe29a7375f03bbd9a5b0bd96555839fbea4abc332ccf",
    "source_published_at": null,
    "sources": null,
    "last_successful_fetch_at": "2026-10-30T15:51:52.222Z",
    "last_attempt_at": "2026-10-30T15:51:52.222Z"
  },
  "key_rate": {
    "value_percent": 14,
    "effective_from": "2026-07-27"
  },
  "cb_rate": 14,
  "source_url": "https://www.cbr.ru/hd_base/keyrate/",
  "effective_from": "2026-07-27",
  "fetched_at": "2026-10-30T15:51:52.222Z",
  "status": "ok"
}
